{
  "version": 1,
  "baseBinding": {
    "path": "bindings/street-native.json",
    "sha256": "8e922b71c68e94b61366b5b334f9e21179c3359bf7b30404b54c87184bee583d"
  },
  "textures": {
    "slab-clean-basecolor": {
      "path": "themes/cyberpunk/assets/street-sidewalk/mid/slab-clean-1/basecolor.png",
      "sha256": "760dc41b5637300722dc400f4af9d75461e2a8b06e876c665697d6305b9ecb6d",
      "resolution": [
        1024,
        1024
      ],
      "colorSpace": "srgb",
      "wrap": [
        "repeat",
        "repeat"
      ],
      "ktx2": "themes/cyberpunk/assets/street-sidewalk/mid/slab-clean-1/basecolor.ktx2",
      "ktx2Sha256": "3d26c7b115ea2f25a531df95fd9c0edf46a21fb78664512a3cbb1a76711d420c"
    },
    "slab-clean-normal": {
      "path": "themes/cyberpunk/assets/street-sidewalk/mid/slab-clean-1/normal.png",
      "sha256": "a4250704ce442dd44236fc3493d07c96a99c8f35aa48f1a7a7f9fa4d079359ce",
      "resolution": [
        1024,
        1024
      ],
      "colorSpace": "linear",
      "wrap": [
        "repeat",
        "repeat"
      ],
      "ktx2": "themes/cyberpunk/assets/street-sidewalk/mid/slab-clean-1/normal.ktx2",
      "ktx2Sha256": "4207123e2d2c7c81e3201a453f612f2464528e894cde791c89fe8e1bc38a6462"
    },
    "slab-clean-roughness": {
      "path": "themes/cyberpunk/assets/street-sidewalk/mid/slab-clean-1/roughness.png",
      "sha256": "dea43d89cb47572ca0a0fe20b47a28ffc3df3523d4ff89f2bbb2ba1202b889f3",
      "resolution": [
        1024,
        1024
      ],
      "colorSpace": "linear",
      "wrap": [
        "repeat",
        "repeat"
      ],
      "ktx2": "themes/cyberpunk/assets/street-sidewalk/mid/slab-clean-1/roughness.ktx2",
      "ktx2Sha256": "6ebafbfa630a06bf1195c7a1597dfeaa2c03745402790a0b3b96edbc01f2a1d6"
    },
    "slab-clean-ao": {
      "path": "themes/cyberpunk/assets/street-sidewalk/mid/slab-clean-1/ao.png",
      "sha256": "e9292215e357cd84b82a2b6af5f865fe97a5cdf945772074bfd041165b8ebaab",
      "resolution": [
        1024,
        1024
      ],
      "colorSpace": "linear",
      "wrap": [
        "repeat",
        "repeat"
      ],
      "ktx2": "themes/cyberpunk/assets/street-sidewalk/mid/slab-clean-1/ao.ktx2",
      "ktx2Sha256": "39c9d8059c1718cd33fdab8f02a17b19e45e2d0e6b0ed9465addf136aded2682"
    },
    "slab-stained-basecolor": {
      "path": "themes/cyberpunk/assets/street-sidewalk/mid/slab-stained-1/basecolor.png",
      "sha256": "00bd7b4400b504ba1d949b5836a06db06845c90a43b16bb1844fb2c36377e60a",
      "resolution": [
        1024,
        1024
      ],
      "colorSpace": "srgb",
      "wrap": [
        "repeat",
        "repeat"
      ],
      "ktx2": "themes/cyberpunk/assets/street-sidewalk/mid/slab-stained-1/basecolor.ktx2",
      "ktx2Sha256": "7b477b4e818130a21931f98b4c9897ef3e5651076249f3a227548257ae7e88e6"
    },
    "slab-stained-normal": {
      "path": "themes/cyberpunk/assets/street-sidewalk/mid/slab-stained-1/normal.png",
      "sha256": "a9bac951d5d5742aaa4cf2fccf3687757739ebc8108603679f6ad5515fdb91d4",
      "resolution": [
        1024,
        1024
      ],
      "colorSpace": "linear",
      "wrap": [
        "repeat",
        "repeat"
      ],
      "ktx2": "themes/cyberpunk/assets/street-sidewalk/mid/slab-stained-1/normal.ktx2",
      "ktx2Sha256": "11afa2c1ee58ac9b8007398afce1ef68d17324deacac73cc217a8900f14853fd"
    },
    "slab-stained-roughness": {
      "path": "themes/cyberpunk/assets/street-sidewalk/mid/slab-stained-1/roughness.png",
      "sha256": "4d776010b4630adf5fb7187648751d87edb278d95a2856426cd96a760b85eb71",
      "resolution": [
        1024,
        1024
      ],
      "colorSpace": "linear",
      "wrap": [
        "repeat",
        "repeat"
      ],
      "ktx2": "themes/cyberpunk/assets/street-sidewalk/mid/slab-stained-1/roughness.ktx2",
      "ktx2Sha256": "e27e55c06505356b957ad1c7b601bb64209cab84b95b8e5f9901a9a4b1d421c0"
    },
    "slab-cracked-basecolor": {
      "path": "themes/cyberpunk/assets/street-sidewalk/mid/slab-cracked-1/basecolor.png",
      "sha256": "efaaf4947cb55fb9fd9186942fdbb8e8290ad73b34f708262e7aa2967d800692",
      "resolution": [
        1024,
        1024
      ],
      "colorSpace": "srgb",
      "wrap": [
        "repeat",
        "repeat"
      ],
      "ktx2": "themes/cyberpunk/assets/street-sidewalk/mid/slab-cracked-1/basecolor.ktx2",
      "ktx2Sha256": "47588a11c16629f4a905a9befe5552c974c76a17cf2ea500fd7a644318a9e2a0"
    },
    "slab-cracked-normal": {
      "path": "themes/cyberpunk/assets/street-sidewalk/mid/slab-cracked-1/normal.png",
      "sha256": "5084041d7c0c172c65ce348643663e28c68df57e7b4d7674e72310411607697f",
      "resolution": [
        1024,
        1024
      ],
      "colorSpace": "linear",
      "wrap": [
        "repeat",
        "repeat"
      ],
      "ktx2": "themes/cyberpunk/assets/street-sidewalk/mid/slab-cracked-1/normal.ktx2",
      "ktx2Sha256": "28e6e42b6dbbd6eadc91747816677efb2584b4be0a7e92f95a465640f7ea9d1a"
    },
    "slab-cracked-roughness": {
      "path": "themes/cyberpunk/assets/street-sidewalk/mid/slab-cracked-1/roughness.png",
      "sha256": "9ef46a00e25ea271dc41a836fff6553d2b057ee1b2b598e232efdd66bbf2005d",
      "resolution": [
        1024,
        1024
      ],
      "colorSpace": "linear",
      "wrap": [
        "repeat",
        "repeat"
      ],
      "ktx2": "themes/cyberpunk/assets/street-sidewalk/mid/slab-cracked-1/roughness.ktx2",
      "ktx2Sha256": "20919d8d6b400d788f5457be0d13025c2662e40a2127b7383f6d022d388ff02f"
    },
    "slab-cracked-ao": {
      "path": "themes/cyberpunk/assets/street-sidewalk/mid/slab-cracked-1/ao.png",
      "sha256": "57b531cc19ea6d7b2ee1f45a6a2b02a9d040daa5a4368ce71bc1868c6c1302e5",
      "resolution": [
        1024,
        1024
      ],
      "colorSpace": "linear",
      "wrap": [
        "repeat",
        "repeat"
      ],
      "ktx2": "themes/cyberpunk/assets/street-sidewalk/mid/slab-cracked-1/ao.ktx2",
      "ktx2Sha256": "16b5758cc0fdd2d6f4dc64faa7525070144005d6525d0a6c5179df5ab2c09684"
    },
    "slab-patched-basecolor": {
      "path": "themes/cyberpunk/assets/street-sidewalk/mid/slab-patched-1/basecolor.png",
      "sha256": "94687bb669236acdde14ddd4e2ed757ec1059e32970a2701e8fd7dbdcbaa6415",
      "resolution": [
        1024,
        1024
      ],
      "colorSpace": "srgb",
      "wrap": [
        "repeat",
        "repeat"
      ],
      "ktx2": "themes/cyberpunk/assets/street-sidewalk/mid/slab-patched-1/basecolor.ktx2",
      "ktx2Sha256": "2e0a7294ae12e93e84fc591e96d4490f93688416ba157b7e3dcfb4eea871acbf"
    },
    "slab-patched-normal": {
      "path": "themes/cyberpunk/assets/street-sidewalk/mid/slab-patched-1/normal.png",
      "sha256": "dc63f1f037848752267b16ed2cc779a894c94d9cf8dbc771192b6e6114299fd3",
      "resolution": [
        1024,
        1024
      ],
      "colorSpace": "linear",
      "wrap": [
        "repeat",
        "repeat"
      ],
      "ktx2": "themes/cyberpunk/assets/street-sidewalk/mid/slab-patched-1/normal.ktx2",
      "ktx2Sha256": "6c19151bd56b12deeb5345b8cfec2fab414622249ab058fe7a4e778024ed6f11"
    },
    "slab-patched-roughness": {
      "path": "themes/cyberpunk/assets/street-sidewalk/mid/slab-patched-1/roughness.png",
      "sha256": "1d4abdb88fb511ded3b5958eb9de12edc60f37be7064d79033d1297d09936df8",
      "resolution": [
        1024,
        1024
      ],
      "colorSpace": "linear",
      "wrap": [
        "repeat",
        "repeat"
      ],
      "ktx2": "themes/cyberpunk/assets/street-sidewalk/mid/slab-patched-1/roughness.ktx2",
      "ktx2Sha256": "4bbb3cd94fd205f770cd35d16162e1fefa24a64b8e02bc85229e3f86756064da"
    },
    "slab-clean-b-basecolor": {
      "path": "themes/cyberpunk/assets/street-sidewalk/mid/slab-clean-2/basecolor.png",
      "sha256": "bdad608f729ed4195d32b861cab3082bc208dbea8b9cf3bdbdaed02aaa22863d",
      "resolution": [
        1024,
        1024
      ],
      "colorSpace": "srgb",
      "wrap": [
        "repeat",
        "repeat"
      ],
      "ktx2": "themes/cyberpunk/assets/street-sidewalk/mid/slab-clean-2/basecolor.ktx2",
      "ktx2Sha256": "5c8fa7c40b1f1c5506f8f1925e89d15beb49f4a0ef15b18d9f5d63f44dd5dcdb"
    },
    "slab-clean-b-normal": {
      "path": "themes/cyberpunk/assets/street-sidewalk/mid/slab-clean-2/normal.png",
      "sha256": "be3b08e841f521f43e7d4a1843eeac60cebff3ca8c2a59d1aab87caa5f81d889",
      "resolution": [
        1024,
        1024
      ],
      "colorSpace": "linear",
      "wrap": [
        "repeat",
        "repeat"
      ],
      "ktx2": "themes/cyberpunk/assets/street-sidewalk/mid/slab-clean-2/normal.ktx2",
      "ktx2Sha256": "4b1eed8807fbddd57a016807be33be144c785e179c1ad5dcb8c25a04fd53685e"
    },
    "slab-clean-b-roughness": {
      "path": "themes/cyberpunk/assets/street-sidewalk/mid/slab-clean-2/roughness.png",
      "sha256": "1e1d7b8c4027f444b8c8d2429ed37986654a3f9590a8de1077ce482c7ec63dde",
      "resolution": [
        1024,
        1024
      ],
      "colorSpace": "linear",
      "wrap": [
        "repeat",
        "repeat"
      ],
      "ktx2": "themes/cyberpunk/assets/street-sidewalk/mid/slab-clean-2/roughness.ktx2",
      "ktx2Sha256": "e812a93567bff7ef4c476e08c607ee621a317079d4f52b801ef6b8a0d51b05a6"
    },
    "slab-stained-b-basecolor": {
      "path": "themes/cyberpunk/assets/street-sidewalk/mid/slab-stained-2/basecolor.png",
      "sha256": "2beffe91c25cd906f067dc4a68a96ab3e0de1123243f544a63b6bd23e3c12f65",
      "resolution": [
        1024,
        1024
      ],
      "colorSpace": "srgb",
      "wrap": [
        "repeat",
        "repeat"
      ],
      "ktx2": "themes/cyberpunk/assets/street-sidewalk/mid/slab-stained-2/basecolor.ktx2",
      "ktx2Sha256": "d31e3d902bd0d21dd8c5e3d36e231765c5584502719b91f6002d4a49c2177bdd"
    },
    "slab-stained-b-normal": {
      "path": "themes/cyberpunk/assets/street-sidewalk/mid/slab-stained-2/normal.png",
      "sha256": "58d04fe5cb8e2d6a114eec9f7667fc756914ce22f7d4cff33d187cc1ee1ee06c",
      "resolution": [
        1024,